商品名,価格,カテゴリ,おすすめ,在庫
ジムビーム,500,アメリカン・バーボン,0,1
クラウンローヤルリザーブ,700,カナディアン,0,1
ウッドフォードリザーブダブルオークド,1300,アメリカン・バーボン,0,1
クラウンローヤル,500,カナディアン,0,1
バランタインファイネスト,500,スコッチ・ブレンデッド,0,1
アードベッグ5年ウィービースティー,800,スコッチ・アイラ,0,1
グレンモーレンジィオリジナル12年,800,スコッチ・ハイランド,0,1
アマハガンエディションno.1,900,ジャパニーズ,0,1
アマハガンエディションNo.2,1200,ジャパニーズ,0,1
アマハガンエディションNo.3,1400,ジャパニーズ,0,1
アマハガン山桜ウッドフィニッシュ,1200,ジャパニーズ,0,1
オクトモア16.1,3200,スコッチ・アイラ,0,1
アードベッグスモーキーバース,2800,スコッチ・アイラ,0,1
アードベッグヘビーベイパース,3500,スコッチ・アイラ,0,1
アードベッグアードコア,2500,スコッチ・アイラ,0,1
アードベッグ10年,1000,スコッチ・アイラ,0,1
フロムザバレル,800,ジャパニーズ,0,1
スプリングバンク10年,2000,スコッチ・キャンベルタウン,1,1
ブラックニッカクリアブレンド旧,500,ジャパニーズ,0,1
パトロンエルアルト,3000,テキーラ,0,1
ラガヴーリン12年カスクストレングス,3200,スコッチ・アイラ,0,1
キャパドニック30年,12000,スコッチ・スペイサイド,1,1
ロイヤルハウスホールド,5500,スコッチ・ブレンデッド,0,1
グレンフィディック21年グランレゼルヴァ,5500,スコッチ・スペイサイド,0,1
バルヴィニー14年カリビアンカスク,2400,スコッチ・スペイサイド,0,1
津貫2026エディション,1400,ジャパニーズ,0,1
ラフロイグ10年シェリーオークフィニッシュ,2000,スコッチ・アイラ,0,1
マッカラン18年シェリーオークカスク,8000,スコッチ・スペイサイド,1,1
バルヴィニー12年ダブルウッド,1600,スコッチ・スペイサイド,0,1
グレンファークラスファミリーカスク1987,18000,スコッチ・スペイサイド,1,1
グレンファークラスファミリーカスク1993,15000,スコッチ・スペイサイド,0,1
グレンファークラスファミリーカスク1996,9500,スコッチ・スペイサイド,0,1
タリスカーポートリー,1700,スコッチ・アイランズ,0,1
ウシュクベーリザーブ,1000,スコッチ・ブレンデッド,0,1
マッカラン12年シェリーオークカスク,1800,スコッチ・スペイサイド,0,1
グレンアラヒー15年,1800,スコッチ・スペイサイド,0,1
グレンモーレンジｨインフィニータ18年,2800,スコッチ・ハイランド,0,1
グレンフィディック15年,1500,スコッチ・スペイサイド,0,1
ボウモア15年,1500,スコッチ・アイラ,0,1
白州12年,3000,ジャパニーズ,0,1
ニッカ鶴陶器,2500,ジャパニーズ,0,1
厚岸しょうかん小寒,3600,ジャパニーズ,1,1
厚岸りっしゅう立秋,3600,ジャパニーズ,0,1
サントリーローヤル60,1000,ジャパニーズ,0,1
サントリーローヤル15年ゴールドラベル,2000,ジャパニーズ,0,1
ブラントン,2200,アメリカン・バーボン,1,1
アイダブルハーパーゴールドメダル特級,1800,アメリカン・バーボン,0,1
ジャックダニエル オールドNo7旧,1200,アメリカン・テネシー,0,1
ノブクリーク9年,800,アメリカン・バーボン,0,1
レッドスポット15年,2000,アイリッシュ,1,1
イエロースポット12年,1600,アイリッシュ,0,1
グリーンスポット,900,アイリッシュ,0,1
ブルースポット7年,1400,アイリッシュ,0,1
ラフロイグPXカスク,1600,スコッチ・アイラ,0,1
グレンフィディックピュアモルトスペシャルオールドリザーブ,1300,スコッチ・スペイサイド,0,1
マッカランレアカスク2023,6500,スコッチ・スペイサイド,0,1
グレンマレイ16年,1500,スコッチ・スペイサイド,0,1
グレンモーレンジィネクター16年,1500,スコッチ・ハイランド,0,1
オーバン12年,2800,スコッチ・ハイランド,0,1
リングウッド12年花と動物シリーズ,1500,スコッチ・スペイサイド,0,1
ブレアアソール12年花と動物シリーズ,1700,スコッチ・ハイランド,0,1
インチガワー14年花と動物シリーズ,1500,スコッチ・スペイサイド,0,1
ビッグT5年ゴールドラベル,1200,スコッチ・ブレンデッド,0,1
カナディアンクラブ6年,800,カナディアン,0,1
クールドリヨンポムプリゾニエール,2200,ブランデー,0,1
プリンスハーバートポリニャック,500,ブランデー,0,1
ロイヤルブラックラ21年,3600,スコッチ・ハイランド,0,1
エンジェルズエンビィ,1800,アメリカン・バーボン,0,1
コードデュローヌルージュ,500,ワイン,0,1
サントリーV.S.O.Pブランデー,500,ブランデー,0,1
サントリーブランデーX.O DELUXE,600,ブランデー,0,1
サントリーブランデーV.S.O.P,500,ブランデー,0,1
アルマニャックナポレオンX.O.,500,ブランデー,0,1
ピスコポルトンアチョラード,1200,ブランデー,0,1
ピスコポルトンモジャール,1200,ブランデー,0,1
戸河内珈琲,600,リキュール,0,1
ベイリーズ,600,リキュール,0,1
マンゴヤン,600,リキュール,0,1
シャンキーズウィップ,1000,リキュール,0,1
巨峰紫,600,リキュール,0,1
ディサローノアマレット,600,リキュール,0,1
クレームドカシス,600,リキュール,0,1
山崎蒸溜所貯蔵梅酒,600,リキュール,0,1
コアントロー,600,リキュール,0,1
アペロール,600,リキュール,0,1
ジファールライチ,900,リキュール,0,1
ジファールCOFFEE,900,リキュール,0,1
グレンドーワン,500,スコッチ・ハイランド,0,1
ジャックダニエル,700,アメリカン・テネシー,0,1
カンパリ,600,リキュール,0,1
ウッドフォードリザーブ,900,アメリカン・バーボン,0,1
デュワーズ12年,700,スコッチ・ブレンデッド,0,1
デュワーズホワイトラベル,500,スコッチ・ブレンデッド,0,1
こげつ,2800,ジャパニーズ,0,1
姫卯,1400,ジャパニーズ,0,1
龍流,700,ジャパニーズ,0,1
LIQUOR MUSEUM masami,9000,ワイン,0,1
ジファールビガレシナシナ,1000,リキュール,0,1
ジファールマントパスティーユ,900,リキュール,0,1
ジファールブルーキュラソー,900,リキュール,0,1
ジファールフルールドスュロソヴァージュ,900,リキュール,0,1
山崎12年,3000,ジャパニーズ,1,1
ジャックダニエルテネシーハニー,500,リキュール,0,1
ジェントルマンジャック,800,アメリカン・テネシー,0,1
ジャックダニエルシングルバレル,1200,アメリカン・テネシー,0,1
メイカーズマークレットトップ,700,アメリカン・バーボン,0,1
バッファロートレイス,900,アメリカン・バーボン,0,1
ブレットバーボン,800,アメリカン・バーボン,0,1
オールドクロウ,500,アメリカン・バーボン,0,1
アーリータイムズブレンデッドホワイトラベル,500,アメリカン・バーボン,0,1
ホイッスルピッグ10年,1500,アメリカン・ライ,0,1
ジェムソンスタンダード,500,アイリッシュ,0,1
ワイルドターキー8年,700,アメリカン・バーボン,0,1
サントリー角瓶,500,ジャパニーズ,0,1
ミクターズUS1バーボンウイスキー,1500,アメリカン・バーボン,0,1
カナディアンクラブ,500,カナディアン,0,1
ブッシュミルズ10年,800,アイリッシュ,0,1
バスカートリプルカスク緑,500,アイリッシュ,0,1
クロナキルティダブルオーク,1100,アイリッシュ,0,1
イーガンズヴィンテージグレーン,1000,アイリッシュ,0,1
ニッカセッション奏楽,900,ジャパニーズ,0,1
ニッカフロンティア,600,ジャパニーズ,0,1
アイダブルハーパー12年,1300,アメリカン・バーボン,0,1
ブッシュミルズ12年,1000,アイリッシュ,0,1
クロナキルティポートカスクフィニッシュ,1100,アイリッシュ,0,1
イーガンズエンデヴァー,1000,アイリッシュ,0,1
イーガンズボンダーズブレンド,700,アイリッシュ,0,1
余市,1400,ジャパニーズ,0,1
宮城峡nv,1400,ジャパニーズ,0,1
竹鶴,1500,ジャパニーズ,0,1
サントリーレッド,500,ジャパニーズ,0,1
サントリーオールド,500,ジャパニーズ,0,1
タカゾーリボーンミズナラカスク,1300,ジャパニーズ,0,1
戸河内プレミアムブレンデッド,700,ジャパニーズ,0,1
戸河内シングルモルト,1300,ジャパニーズ,0,1
六甲山スモーキーエディション,1200,ジャパニーズ,0,1
サントリーローヤル80年代前後流通,500,ジャパニーズ,0,1
サントリーリザーブ,500,ジャパニーズ,0,1
御岳ファーストエディション,2800,ジャパニーズ,0,1
タカゾーリボーンプラムワインカスクフィニッシュ,1000,ジャパニーズ,0,1
六甲山水楢ミズナラ,2000,ジャパニーズ,0,1
響ジャパニーズハーモニー,1500,ジャパニーズ,1,1
白州,1400,ジャパニーズ,0,1
山崎,1400,ジャパニーズ,0,1
知多,1200,ジャパニーズ,0,1
イチローズモルト&グレーンワールドブレンデッド,900,ジャパニーズ,0,1
桜尾シェリーカスク,2300,ジャパニーズ,0,1
桜尾,1200,ジャパニーズ,0,1
六甲山杉樽フィニッシュ5年,1500,ジャパニーズ,0,1
クロナキルティミンクジン,1000,ジン,0,1
ナンバーテン,900,ジン,0,1
桜尾ジン,600,ジン,0,1
舞輪源蒸溜所,1200,ジン,0,1
六ジン,900,ジン,0,1
翠スイ,600,ジン,0,1
瀬戸内檸檬ジン,800,ジン,0,1
シックスジントロピカルマンゴージン,800,ジン,0,1
瀬戸内甘夏ジン,800,ジン,0,1
スケープグレイスブラッドオレンジ,1200,ジン,0,1
ジンマーレ,900,ジン,0,1
ブルーラビットディスティラリートーキョードライジン,1000,ジン,0,1
シックスジンスパイスマジックジン,800,ジン,0,1
スケープグレイスブラックジン,1000,ジン,0,1
ボンベイサファイアドライジン,700,ジン,0,1
サイレントプールジン,1000,ジン,0,1
キノビ季の美,900,ジン,1,1
ヤマレストオーディナリー,1000,ジン,0,1
シックスジンレモンシトリックアシッドジン,800,ジン,0,1
シックスジンエビスジン,1000,ジン,0,1
アランバレルリザーブ,1000,スコッチ・アイランズ,0,1
カリラ12年,1200,スコッチ・アイラ,0,1
ボウモア12年,1200,スコッチ・アイラ,0,1
ラフロイグ10年,1400,スコッチ・アイラ,0,1
タリスカー10年,900,スコッチ・アイランズ,0,1
ダルヴィニー15年,1300,スコッチ・ハイランド,0,1
ロイヤルロッホナガー12年,900,スコッチ・ハイランド,0,1
グレンファークラス10年,900,スコッチ・スペイサイド,0,1
グレンファークラス12年,900,スコッチ・スペイサイド,0,1
ラガヴーリン8年,1200,スコッチ・アイラ,0,1
ポートシャーロット10年,1200,スコッチ・アイラ,0,1
アラン10年,1200,スコッチ・アイランズ,0,1
アランクォーターカスク,1300,スコッチ・アイランズ,0,1
グレンキンチー12年,900,スコッチ・ローランド,0,1
グレンドロナック12年,1300,スコッチ・ハイランド,0,1
ブルックラディ　ザクラシックラディ,900,スコッチ・アイラ,0,1
グランファークラス15年,1500,スコッチ・スペイサイド,0,1
ラガヴーリン16年,1800,スコッチ・アイラ,0,1
アランシェリーカスク,1600,スコッチ・アイランズ,0,1
キルホーマン,1400,スコッチ・アイラ,0,1
ラグ,1400,スコッチ・アイランズ,0,1
オーバン14年,1600,スコッチ・ハイランド,0,1
グレンドロナック15年,2100,スコッチ・ハイランド,0,1
ロイヤルブラックラ18年,2200,スコッチ・ハイランド,0,1
グレンアラヒー12年,1500,スコッチ・スペイサイド,0,1
ローズアイル12年,2200,スコッチ・スペイサイド,0,1
グレングラントアルボラリス,700,スコッチ・スペイサイド,0,1
グレンフィディック12年,900,スコッチ・スペイサイド,0,1
シングルトン12年,900,スコッチ・スペイサイド,0,1
オールドパー12年,700,スコッチ・ブレンデッド,0,1
カティーサーク,500,スコッチ・ブレンデッド,0,1
ベンリアック10年,1000,スコッチ・スペイサイド,0,1
グレングラント10年,800,スコッチ・スペイサイド,0,1
クライヌリッシュ14年,1400,スコッチ・ハイランド,0,1
シーバスリーガルミズナラ12年,800,スコッチ・ブレンデッド,0,1
ベンリアック12年,1300,スコッチ・スペイサイド,0,1
グレングラント12年,1000,スコッチ・スペイサイド,0,1
クラガンモア12年,1200,スコッチ・スペイサイド,0,1
グレンリベット12年,800,スコッチ・スペイサイド,0,1
デュワーズ15年,1400,スコッチ・ブレンデッド,0,1
デュワーズダブルダブル21年,2700,スコッチ・ブレンデッド,0,1
キャンベルタウンロッホ,1800,スコッチ・キャンベルタウン,0,1
ホワイトアンドマッカリー,500,スコッチ・ブレンデッド,0,1
ディプロマティコレセルバエクスルーシバ,1000,ラム,0,1
ホワイトホース1989年以前,900,スコッチ・ブレンデッド,0,1
トレスレイステポサドゴールド,600,テキーラ,0,1
スミノフウォッカ,600,ウォッカ,0,1
トレスレイスシルバー,600,テキーラ,0,1
ビーフィータードライジン,600,ジン,0,1
エラドゥーラプラタシルバー,1000,テキーラ,0,1
プランテーション,1400,ラム,0,1
ジョニーウォーカー黒ラベル90年代流通,600,スコッチ・ブレンデッド,0,1
フェイマスグラウス,500,スコッチ・ブレンデッド,0,1
ディーコン,700,スコッチ・ブレンデッド,0,1
モンキーショルダー,800,スコッチ・ブレンデッド,0,1
ジョニーウォーカー黒ラベル80年代流通,900,スコッチ・ブレンデッド,0,1
パトロンテキーラシルバー,1300,テキーラ,0,1
グレイグース,900,ウォッカ,0,1
タンカレーTanquerayドライジン,600,ジン,0,1
バカルディ,600,ラム,0,1
ジョニーウォーカーブルーラベル,3000,スコッチ・ブレンデッド,0,1
